[{"entry_id":"c08fcd72-9c97-5524-a907-b56ba81ddcd5","language_tag":"es","lemma":"la pensión completa","part_of_speech":"noun","senses":[{"sense_id":"s1","translations":["la pension complète"],"example_source":"El hotel ofrece pensión completa.","example_target":"L’hôtel propose la pension complète."}],"cefr_level":"A2","cefr_rationale":"Candidat éditorial A2 — inventaires notionnels PCIC à valider","themes":["voyage"],"variety":"pan-hispanic-common","provenance":{"source":"Reversolinguo editorial archive fr-es-a1-b2-school-progression-r1-2026-09-15; external references are used only for CEFR/domain framing","license":"CC BY 4.0","authored_by":"Reversolinguo project editorial draft"},"status":"draft","version":1},{"entry_id":"9560bd6c-5d96-5cae-8941-be152f05db9a","language_tag":"es","lemma":"la media pensión","part_of_speech":"noun","senses":[{"sense_id":"s1","translations":["la demi-pension"],"example_source":"Hemos reservado el hotel en media pensión.","example_target":"Nous avons réservé l’hôtel en demi-pension."}],"cefr_level":"A2","cefr_rationale":"Candidat éditorial A2 — inventaires notionnels PCIC à valider","themes":["voyage"],"variety":"pan-hispanic-common","provenance":{"source":"Reversolinguo editorial archive fr-es-a1-b2-school-progression-r1-2026-09-15; external references are used only for CEFR/domain framing","license":"CC BY 4.0","authored_by":"Reversolinguo project editorial draft"},"status":"draft","version":1},{"entry_id":"9bb99433-1d38-552a-8788-1778b877a399","language_tag":"es","lemma":"alojamiento y desayuno","part_of_speech":"expression","senses":[{"sense_id":"s1","translations":["hébergement et petit-déjeuner"],"example_source":"La reserva incluye alojamiento y desayuno.","example_target":"La réservation comprend l’hébergement et le petit-déjeuner."}],"cefr_level":"A2","cefr_rationale":"Candidat éditorial A2 — inventaires notionnels PCIC à valider","themes":["voyage"],"variety":"pan-hispanic-common","provenance":{"source":"Reversolinguo editorial archive fr-es-a1-b2-school-progression-r1-2026-09-15; external references are used only for CEFR/domain framing","license":"CC BY 4.0","authored_by":"Reversolinguo project editorial draft"},"status":"draft","version":1},{"entry_id":"7e55fa11-5e2c-50a2-a31b-bc3be28fa8a4","language_tag":"es","lemma":"hacer una reserva","part_of_speech":"expression","senses":[{"sense_id":"s1","translations":["faire une réservation"],"example_source":"Quiero hacer una reserva para dos noches.","example_target":"Je veux faire une réservation pour deux nuits."}],"cefr_level":"A2","cefr_rationale":"Candidat éditorial A2 — inventaires notionnels PCIC à valider","themes":["voyage"],"variety":"pan-hispanic-common","provenance":{"source":"Reversolinguo editorial archive fr-es-a1-b2-school-progression-r1-2026-09-15; external references are used only for CEFR/domain framing","license":"CC BY 4.0","authored_by":"Reversolinguo project editorial draft"},"status":"draft","version":1},{"entry_id":"2966a865-1861-5ee9-9b41-75728b5cdc6c","language_tag":"es","lemma":"la boca de metro","part_of_speech":"noun","senses":[{"sense_id":"s1","translations":["l’entrée de métro"],"example_source":"La boca de metro está al otro lado de la calle.","example_target":"L’entrée de métro est de l’autre côté de la rue."}],"cefr_level":"A2","cefr_rationale":"Candidat éditorial A2 — inventaires notionnels PCIC à valider","themes":["voyage"],"variety":"pan-hispanic-common","provenance":{"source":"Reversolinguo editorial archive fr-es-a1-b2-school-progression-r1-2026-09-15; external references are used only for CEFR/domain framing","license":"CC BY 4.0","authored_by":"Reversolinguo project editorial draft"},"status":"draft","version":1},{"entry_id":"a44d72b4-4226-5bda-a48f-16828b4bc3cb","language_tag":"es","lemma":"el ciclista / la ciclista","part_of_speech":"noun","senses":[{"sense_id":"s1","translations":["le cycliste / la cycliste"],"example_source":"La ciclista espera delante del semáforo.","example_target":"La cycliste attend devant le feu."}],"cefr_level":"A2","cefr_rationale":"Candidat éditorial A2 — inventaires notionnels PCIC à valider","themes":["voyage"],"variety":"pan-hispanic-common","provenance":{"source":"Reversolinguo editorial archive fr-es-a1-b2-school-progression-r1-2026-09-15; external references are used only for CEFR/domain framing","license":"CC BY 4.0","authored_by":"Reversolinguo project editorial draft"},"status":"draft","version":1},{"entry_id":"8e50d398-2f1a-513f-830b-47e61444dd25","language_tag":"es","lemma":"coger un taxi","part_of_speech":"expression","senses":[{"sense_id":"s1","translations":["prendre un taxi"],"example_source":"En España, podemos coger un taxi en la estación.","example_target":"En Espagne, nous pouvons prendre un taxi à la gare.","note":"Usage courant en Espagne ; « tomar » est une variante recommandée dans les zones où « coger » est évité."}],"cefr_level":"A2","cefr_rationale":"Candidat éditorial A2 — inventaires notionnels PCIC à valider","themes":["voyage"],"variety":"Spain-common-with-pan-Hispanic-variant","provenance":{"source":"Reversolinguo editorial archive fr-es-a1-b2-school-progression-r1-2026-09-15; external references are used only for CEFR/domain framing","license":"CC BY 4.0","authored_by":"Reversolinguo project editorial draft"},"status":"draft","version":1},{"entry_id":"fab8c1f4-7212-56e2-931c-fba2ce1e1909","language_tag":"es","lemma":"tomar un taxi","part_of_speech":"expression","senses":[{"sense_id":"s1","translations":["prendre un taxi"],"example_source":"Vamos a tomar un taxi hasta el hotel.","example_target":"Nous allons prendre un taxi jusqu’à l’hôtel."}],"cefr_level":"A2","cefr_rationale":"Candidat éditorial A2 — inventaires notionnels PCIC à valider","themes":["voyage"],"variety":"pan-hispanic-common","provenance":{"source":"Reversolinguo editorial archive fr-es-a1-b2-school-progression-r1-2026-09-15; external references are used only for CEFR/domain framing","license":"CC BY 4.0","authored_by":"Reversolinguo project editorial draft"},"status":"draft","version":1},{"entry_id":"93bf6a68-8358-531e-993e-9c4a166daa60","language_tag":"es","lemma":"coger el metro","part_of_speech":"expression","senses":[{"sense_id":"s1","translations":["prendre le métro"],"example_source":"En España, cogemos el metro para ir al centro.","example_target":"En Espagne, nous prenons le métro pour aller au centre.","note":"Usage courant en Espagne ; « tomar » est une variante recommandée dans les zones où « coger » est évité."}],"cefr_level":"A2","cefr_rationale":"Candidat éditorial A2 — inventaires notionnels PCIC à valider","themes":["voyage"],"variety":"Spain-common-with-pan-Hispanic-variant","provenance":{"source":"Reversolinguo editorial archive fr-es-a1-b2-school-progression-r1-2026-09-15; external references are used only for CEFR/domain framing","license":"CC BY 4.0","authored_by":"Reversolinguo project editorial draft"},"status":"draft","version":1},{"entry_id":"da686af9-5485-553d-9f57-4dc8b5b23cd9","language_tag":"es","lemma":"tomar el metro","part_of_speech":"expression","senses":[{"sense_id":"s1","translations":["prendre le métro"],"example_source":"Tomamos el metro en la próxima estación.","example_target":"Nous prenons le métro à la prochaine station."}],"cefr_level":"A2","cefr_rationale":"Candidat éditorial A2 — inventaires notionnels PCIC à valider","themes":["voyage"],"variety":"pan-hispanic-common","provenance":{"source":"Reversolinguo editorial archive fr-es-a1-b2-school-progression-r1-2026-09-15; external references are used only for CEFR/domain framing","license":"CC BY 4.0","authored_by":"Reversolinguo project editorial draft"},"status":"draft","version":1},{"entry_id":"55fce41d-b525-5ad7-8f95-bbc64a8daae9","language_tag":"es","lemma":"coger el tren","part_of_speech":"expression","senses":[{"sense_id":"s1","translations":["prendre le train"],"example_source":"En España, cogemos el tren de las ocho.","example_target":"En Espagne, nous prenons le train de huit heures.","note":"Usage courant en Espagne ; « tomar » est une variante recommandée dans les zones où « coger » est évité."}],"cefr_level":"A2","cefr_rationale":"Candidat éditorial A2 — inventaires notionnels PCIC à valider","themes":["voyage"],"variety":"Spain-common-with-pan-Hispanic-variant","provenance":{"source":"Reversolinguo editorial archive fr-es-a1-b2-school-progression-r1-2026-09-15; external references are used only for CEFR/domain framing","license":"CC BY 4.0","authored_by":"Reversolinguo project editorial draft"},"status":"draft","version":1}]