[{"entry_id":"b0b55ed3-f71d-5153-b4fa-5102171de5f3","language_tag":"es","lemma":"coger","part_of_speech":"verb","senses":[{"sense_id":"s1","translations":["prendre / saisir"],"example_source":"En España, cojo el autobús para ir al centro.","example_target":"En Espagne, je prends le bus pour aller au centre.","note":"Usage courant en Espagne ; dans de nombreux pays d’Amérique latine, « tomar » est préférable pour le sens « prendre » un transport ou un objet."}],"cefr_level":"A2","cefr_rationale":"Candidat éditorial A2 — inventaires notionnels PCIC à valider","themes":["corps-sante"],"variety":"Spain-common-with-pan-Hispanic-context","provenance":{"source":"Reversolinguo editorial archive fr-es-a1-b2-school-progression-r1-2026-09-15; external references are used only for CEFR/domain framing","license":"CC BY 4.0","authored_by":"Reversolinguo project editorial draft"},"status":"draft","version":1},{"entry_id":"a1f9783e-8f07-5a4c-a9cc-40ac1198f869","language_tag":"es","lemma":"nacer","part_of_speech":"verb","senses":[{"sense_id":"s1","translations":["naître"],"example_source":"Mi hermano nació en Madrid.","example_target":"Mon frère est né à Madrid."}],"cefr_level":"A2","cefr_rationale":"Candidat éditorial A2 — inventaires notionnels PCIC à valider","themes":["corps-sante"],"variety":"pan-hispanic-common","provenance":{"source":"Reversolinguo editorial archive fr-es-a1-b2-school-progression-r1-2026-09-15; external references are used only for CEFR/domain framing","license":"CC BY 4.0","authored_by":"Reversolinguo project editorial draft"},"status":"draft","version":1},{"entry_id":"8ac0c920-8366-5c97-9074-8ebcdaed15df","language_tag":"es","lemma":"crecer","part_of_speech":"verb","senses":[{"sense_id":"s1","translations":["grandir"],"example_source":"Los niños crecen muy rápido.","example_target":"Les enfants grandissent très vite."}],"cefr_level":"A2","cefr_rationale":"Candidat éditorial A2 — inventaires notionnels PCIC à valider","themes":["corps-sante"],"variety":"pan-hispanic-common","provenance":{"source":"Reversolinguo editorial archive fr-es-a1-b2-school-progression-r1-2026-09-15; external references are used only for CEFR/domain framing","license":"CC BY 4.0","authored_by":"Reversolinguo project editorial draft"},"status":"draft","version":1},{"entry_id":"18e1ac14-5e07-5edc-86d2-11226b4a9d58","language_tag":"es","lemma":"tener un hijo","part_of_speech":"expression","senses":[{"sense_id":"s1","translations":["avoir un enfant"],"example_source":"Quieren tener un hijo.","example_target":"Ils veulent avoir un enfant."}],"cefr_level":"A2","cefr_rationale":"Candidat éditorial A2 — inventaires notionnels PCIC à valider","themes":["corps-sante"],"variety":"pan-hispanic-common","provenance":{"source":"Reversolinguo editorial archive fr-es-a1-b2-school-progression-r1-2026-09-15; external references are used only for CEFR/domain framing","license":"CC BY 4.0","authored_by":"Reversolinguo project editorial draft"},"status":"draft","version":1},{"entry_id":"57e9484f-a7a4-5ea6-94b4-f169db46baf3","language_tag":"es","lemma":"morir","part_of_speech":"verb","senses":[{"sense_id":"s1","translations":["mourir"],"example_source":"Su abuelo murió hace muchos años.","example_target":"Son grand-père est mort il y a de nombreuses années."}],"cefr_level":"A2","cefr_rationale":"Candidat éditorial A2 — inventaires notionnels PCIC à valider","themes":["corps-sante"],"variety":"pan-hispanic-common","provenance":{"source":"Reversolinguo editorial archive fr-es-a1-b2-school-progression-r1-2026-09-15; external references are used only for CEFR/domain framing","license":"CC BY 4.0","authored_by":"Reversolinguo project editorial draft"},"status":"draft","version":1},{"entry_id":"644a77ef-52d4-5e89-91f6-fdb1723d70d3","language_tag":"es","lemma":"el sexo","part_of_speech":"noun","senses":[{"sense_id":"s1","translations":["le sexe"],"example_source":"El formulario pregunta por el sexo.","example_target":"Le formulaire demande le sexe."}],"cefr_level":"A2","cefr_rationale":"Candidat éditorial A2 — inventaires notionnels PCIC à valider","themes":["corps-sante"],"variety":"pan-hispanic-common","provenance":{"source":"Reversolinguo editorial archive fr-es-a1-b2-school-progression-r1-2026-09-15; external references are used only for CEFR/domain framing","license":"CC BY 4.0","authored_by":"Reversolinguo project editorial draft"},"status":"draft","version":1},{"entry_id":"9e1b46ca-9768-5133-b6f8-881e0a9337da","language_tag":"es","lemma":"la gripe","part_of_speech":"noun","senses":[{"sense_id":"s1","translations":["la grippe"],"example_source":"Tengo gripe y me quedo en casa.","example_target":"J’ai la grippe et je reste à la maison."}],"cefr_level":"A2","cefr_rationale":"Candidat éditorial A2 — inventaires notionnels PCIC à valider","themes":["corps-sante"],"variety":"pan-hispanic-common","provenance":{"source":"Reversolinguo editorial archive fr-es-a1-b2-school-progression-r1-2026-09-15; external references are used only for CEFR/domain framing","license":"CC BY 4.0","authored_by":"Reversolinguo project editorial draft"},"status":"draft","version":1},{"entry_id":"755ec1a8-5870-54f9-8289-48b121b31457","language_tag":"es","lemma":"la alergia","part_of_speech":"noun","senses":[{"sense_id":"s1","translations":["l’allergie"],"example_source":"Tengo alergia al polen.","example_target":"J’ai une allergie au pollen."}],"cefr_level":"A2","cefr_rationale":"Candidat éditorial A2 — inventaires notionnels PCIC à valider","themes":["corps-sante"],"variety":"pan-hispanic-common","provenance":{"source":"Reversolinguo editorial archive fr-es-a1-b2-school-progression-r1-2026-09-15; external references are used only for CEFR/domain framing","license":"CC BY 4.0","authored_by":"Reversolinguo project editorial draft"},"status":"draft","version":1},{"entry_id":"5c861a49-d087-5e29-826a-0597df56bb31","language_tag":"es","lemma":"la fiebre","part_of_speech":"noun","senses":[{"sense_id":"s1","translations":["la fièvre"],"example_source":"Tiene fiebre desde ayer.","example_target":"Il a de la fièvre depuis hier."}],"cefr_level":"A2","cefr_rationale":"Candidat éditorial A2 — inventaires notionnels PCIC à valider","themes":["corps-sante"],"variety":"pan-hispanic-common","provenance":{"source":"Reversolinguo editorial archive fr-es-a1-b2-school-progression-r1-2026-09-15; external references are used only for CEFR/domain framing","license":"CC BY 4.0","authored_by":"Reversolinguo project editorial draft"},"status":"draft","version":1},{"entry_id":"faa8ac61-3415-5a94-849e-7e629e0f51d0","language_tag":"es","lemma":"la tos","part_of_speech":"noun","senses":[{"sense_id":"s1","translations":["la toux"],"example_source":"La tos no me deja dormir.","example_target":"La toux m’empêche de dormir."}],"cefr_level":"A2","cefr_rationale":"Candidat éditorial A2 — inventaires notionnels PCIC à valider","themes":["corps-sante"],"variety":"pan-hispanic-common","provenance":{"source":"Reversolinguo editorial archive fr-es-a1-b2-school-progression-r1-2026-09-15; external references are used only for CEFR/domain framing","license":"CC BY 4.0","authored_by":"Reversolinguo project editorial draft"},"status":"draft","version":1},{"entry_id":"84fd1307-cc24-5e17-a98a-ec36e54f9ace","language_tag":"es","lemma":"tener fiebre","part_of_speech":"expression","senses":[{"sense_id":"s1","translations":["avoir de la fièvre"],"example_source":"El niño tiene fiebre.","example_target":"L’enfant a de la fièvre."}],"cefr_level":"A2","cefr_rationale":"Candidat éditorial A2 — inventaires notionnels PCIC à valider","themes":["corps-sante"],"variety":"pan-hispanic-common","provenance":{"source":"Reversolinguo editorial archive fr-es-a1-b2-school-progression-r1-2026-09-15; external references are used only for CEFR/domain framing","license":"CC BY 4.0","authored_by":"Reversolinguo project editorial draft"},"status":"draft","version":1}]
