[{"entry_id":"604345f8-b5e7-5459-9cee-2d91a51f5dae","language_tag":"es","lemma":"la calle peatonal","part_of_speech":"noun","senses":[{"sense_id":"s1","translations":["la rue piétonne"],"example_source":"Esta calle peatonal está llena de tiendas.","example_target":"Cette rue piétonne est pleine de magasins."}],"cefr_level":"A2","cefr_rationale":"Candidat éditorial A2 — inventaires notionnels PCIC à valider","themes":["ville-services"],"variety":"pan-hispanic-common","provenance":{"source":"Reversolinguo editorial archive fr-es-a1-b2-school-progression-r1-2026-09-15; external references are used only for CEFR/domain framing","license":"CC BY 4.0","authored_by":"Reversolinguo project editorial draft"},"status":"draft","version":1},{"entry_id":"0d0ea78a-8241-56d7-95a8-26ff42661634","language_tag":"es","lemma":"la lluvia","part_of_speech":"noun","senses":[{"sense_id":"s1","translations":["la pluie"],"example_source":"La lluvia empieza esta tarde.","example_target":"La pluie commence cet après-midi."}],"cefr_level":"A2","cefr_rationale":"Candidat éditorial A2 — inventaires notionnels PCIC à valider","themes":["meteo"],"variety":"pan-hispanic-common","provenance":{"source":"Reversolinguo editorial archive fr-es-a1-b2-school-progression-r1-2026-09-15; external references are used only for CEFR/domain framing","license":"CC BY 4.0","authored_by":"Reversolinguo project editorial draft"},"status":"draft","version":1},{"entry_id":"c35fd538-f142-50ae-986a-f5123f8946bc","language_tag":"es","lemma":"la nieve","part_of_speech":"noun","senses":[{"sense_id":"s1","translations":["la neige"],"example_source":"La nieve cubre las montañas.","example_target":"La neige couvre les montagnes."}],"cefr_level":"A2","cefr_rationale":"Candidat éditorial A2 — inventaires notionnels PCIC à valider","themes":["meteo"],"variety":"pan-hispanic-common","provenance":{"source":"Reversolinguo editorial archive fr-es-a1-b2-school-progression-r1-2026-09-15; external references are used only for CEFR/domain framing","license":"CC BY 4.0","authored_by":"Reversolinguo project editorial draft"},"status":"draft","version":1},{"entry_id":"28c0f64e-809b-5458-9892-0a0dd0345206","language_tag":"es","lemma":"la niebla","part_of_speech":"noun","senses":[{"sense_id":"s1","translations":["le brouillard"],"example_source":"Hay mucha niebla esta mañana.","example_target":"Il y a beaucoup de brouillard ce matin."}],"cefr_level":"A2","cefr_rationale":"Candidat éditorial A2 — inventaires notionnels PCIC à valider","themes":["meteo"],"variety":"pan-hispanic-common","provenance":{"source":"Reversolinguo editorial archive fr-es-a1-b2-school-progression-r1-2026-09-15; external references are used only for CEFR/domain framing","license":"CC BY 4.0","authored_by":"Reversolinguo project editorial draft"},"status":"draft","version":1},{"entry_id":"1bacbcc2-eb9d-5244-aed5-c4971c190344","language_tag":"es","lemma":"la tormenta","part_of_speech":"noun","senses":[{"sense_id":"s1","translations":["l’orage / la tempête"],"example_source":"La tormenta llega por la noche.","example_target":"L’orage arrive pendant la nuit."}],"cefr_level":"A2","cefr_rationale":"Candidat éditorial A2 — inventaires notionnels PCIC à valider","themes":["meteo"],"variety":"pan-hispanic-common","provenance":{"source":"Reversolinguo editorial archive fr-es-a1-b2-school-progression-r1-2026-09-15; external references are used only for CEFR/domain framing","license":"CC BY 4.0","authored_by":"Reversolinguo project editorial draft"},"status":"draft","version":1},{"entry_id":"7e0e6639-2bd4-51b8-b4f9-d47d0f114eb0","language_tag":"es","lemma":"la nube","part_of_speech":"noun","senses":[{"sense_id":"s1","translations":["le nuage"],"example_source":"Esa nube es muy oscura.","example_target":"Ce nuage est très sombre."}],"cefr_level":"A2","cefr_rationale":"Candidat éditorial A2 — inventaires notionnels PCIC à valider","themes":["meteo"],"variety":"pan-hispanic-common","provenance":{"source":"Reversolinguo editorial archive fr-es-a1-b2-school-progression-r1-2026-09-15; external references are used only for CEFR/domain framing","license":"CC BY 4.0","authored_by":"Reversolinguo project editorial draft"},"status":"draft","version":1},{"entry_id":"a026619e-1cb6-5c66-83b6-24b9e49e1bf7","language_tag":"es","lemma":"el aire","part_of_speech":"noun","senses":[{"sense_id":"s1","translations":["l’air"],"example_source":"El aire está fresco esta mañana.","example_target":"L’air est frais ce matin."}],"cefr_level":"A2","cefr_rationale":"Candidat éditorial A2 — inventaires notionnels PCIC à valider","themes":["meteo"],"variety":"pan-hispanic-common","provenance":{"source":"Reversolinguo editorial archive fr-es-a1-b2-school-progression-r1-2026-09-15; external references are used only for CEFR/domain framing","license":"CC BY 4.0","authored_by":"Reversolinguo project editorial draft"},"status":"draft","version":1},{"entry_id":"6e9b11b1-8967-557e-a1ec-f4171cd6bc2b","language_tag":"es","lemma":"el viento del norte","part_of_speech":"noun","senses":[{"sense_id":"s1","translations":["le vent du nord"],"example_source":"El viento del norte trae frío.","example_target":"Le vent du nord apporte du froid."}],"cefr_level":"A2","cefr_rationale":"Candidat éditorial A2 — inventaires notionnels PCIC à valider","themes":["meteo"],"variety":"pan-hispanic-common","provenance":{"source":"Reversolinguo editorial archive fr-es-a1-b2-school-progression-r1-2026-09-15; external references are used only for CEFR/domain framing","license":"CC BY 4.0","authored_by":"Reversolinguo project editorial draft"},"status":"draft","version":1},{"entry_id":"5eefd4d7-b57c-5fa8-b461-19c2b6f20d9c","language_tag":"es","lemma":"el pez","part_of_speech":"noun","senses":[{"sense_id":"s1","translations":["le poisson (animal)"],"example_source":"Hay un pez pequeño en el río.","example_target":"Il y a un petit poisson dans la rivière."}],"cefr_level":"A2","cefr_rationale":"Candidat éditorial A2 — inventaires notionnels PCIC à valider","themes":["nature-environnement"],"variety":"pan-hispanic-common","provenance":{"source":"Reversolinguo editorial archive fr-es-a1-b2-school-progression-r1-2026-09-15; external references are used only for CEFR/domain framing","license":"CC BY 4.0","authored_by":"Reversolinguo project editorial draft"},"status":"draft","version":1},{"entry_id":"5fb2048d-7bdc-5858-8914-99db6e9948c1","language_tag":"es","lemma":"el caballo","part_of_speech":"noun","senses":[{"sense_id":"s1","translations":["le cheval"],"example_source":"El caballo corre por el campo.","example_target":"Le cheval court dans le champ."}],"cefr_level":"A2","cefr_rationale":"Candidat éditorial A2 — inventaires notionnels PCIC à valider","themes":["nature-environnement"],"variety":"pan-hispanic-common","provenance":{"source":"Reversolinguo editorial archive fr-es-a1-b2-school-progression-r1-2026-09-15; external references are used only for CEFR/domain framing","license":"CC BY 4.0","authored_by":"Reversolinguo project editorial draft"},"status":"draft","version":1},{"entry_id":"6fb4c48e-3f73-56f4-8be7-89486c2663e1","language_tag":"es","lemma":"la vaca","part_of_speech":"noun","senses":[{"sense_id":"s1","translations":["la vache"],"example_source":"La vaca está en el prado.","example_target":"La vache est dans le pré."}],"cefr_level":"A2","cefr_rationale":"Candidat éditorial A2 — inventaires notionnels PCIC à valider","themes":["nature-environnement"],"variety":"pan-hispanic-common","provenance":{"source":"Reversolinguo editorial archive fr-es-a1-b2-school-progression-r1-2026-09-15; external references are used only for CEFR/domain framing","license":"CC BY 4.0","authored_by":"Reversolinguo project editorial draft"},"status":"draft","version":1}]