[{"entry_id":"676b03de-d0b0-5d59-9d40-f047cfbc5aaf","language_tag":"es","lemma":"el suroeste","part_of_speech":"noun","senses":[{"sense_id":"s1","translations":["le sud-ouest"],"example_source":"Viajamos por el suroeste de la región.","example_target":"Nous voyageons dans le sud-ouest de la région."}],"cefr_level":"A2","cefr_rationale":"Candidat éditorial A2 — inventaires notionnels PCIC à valider","themes":["ville-services"],"variety":"pan-hispanic-common","provenance":{"source":"Reversolinguo editorial archive fr-es-a1-b2-school-progression-r1-2026-09-15; external references are used only for CEFR/domain framing","license":"CC BY 4.0","authored_by":"Reversolinguo project editorial draft"},"status":"draft","version":1},{"entry_id":"711c91c8-c28e-551c-88e4-35f3b093e1ba","language_tag":"es","lemma":"el sureste","part_of_speech":"noun","senses":[{"sense_id":"s1","translations":["le sud-est"],"example_source":"La playa está en el sureste de la isla.","example_target":"La plage se trouve dans le sud-est de l’île."}],"cefr_level":"A2","cefr_rationale":"Candidat éditorial A2 — inventaires notionnels PCIC à valider","themes":["ville-services"],"variety":"pan-hispanic-common","provenance":{"source":"Reversolinguo editorial archive fr-es-a1-b2-school-progression-r1-2026-09-15; external references are used only for CEFR/domain framing","license":"CC BY 4.0","authored_by":"Reversolinguo project editorial draft"},"status":"draft","version":1},{"entry_id":"9064dccc-ae37-51f5-a373-de47ea2afe7f","language_tag":"es","lemma":"la isla","part_of_speech":"noun","senses":[{"sense_id":"s1","translations":["l’île"],"example_source":"La isla tiene playas muy bonitas.","example_target":"L’île a de très belles plages."}],"cefr_level":"A2","cefr_rationale":"Candidat éditorial A2 — inventaires notionnels PCIC à valider","themes":["nature-environnement"],"variety":"pan-hispanic-common","provenance":{"source":"Reversolinguo editorial archive fr-es-a1-b2-school-progression-r1-2026-09-15; external references are used only for CEFR/domain framing","license":"CC BY 4.0","authored_by":"Reversolinguo project editorial draft"},"status":"draft","version":1},{"entry_id":"e8196d8c-b820-5515-ab7d-5b75bebb28dd","language_tag":"es","lemma":"el desierto","part_of_speech":"noun","senses":[{"sense_id":"s1","translations":["le désert"],"example_source":"En el desierto hace mucho calor de día.","example_target":"Dans le désert, il fait très chaud le jour."}],"cefr_level":"A2","cefr_rationale":"Candidat éditorial A2 — inventaires notionnels PCIC à valider","themes":["nature-environnement"],"variety":"pan-hispanic-common","provenance":{"source":"Reversolinguo editorial archive fr-es-a1-b2-school-progression-r1-2026-09-15; external references are used only for CEFR/domain framing","license":"CC BY 4.0","authored_by":"Reversolinguo project editorial draft"},"status":"draft","version":1},{"entry_id":"f912f67b-eebf-5813-8429-e66d70c6dbb3","language_tag":"es","lemma":"el bosque","part_of_speech":"noun","senses":[{"sense_id":"s1","translations":["la forêt"],"example_source":"Paseamos por el bosque.","example_target":"Nous nous promenons dans la forêt."}],"cefr_level":"A2","cefr_rationale":"Candidat éditorial A2 — inventaires notionnels PCIC à valider","themes":["nature-environnement"],"variety":"pan-hispanic-common","provenance":{"source":"Reversolinguo editorial archive fr-es-a1-b2-school-progression-r1-2026-09-15; external references are used only for CEFR/domain framing","license":"CC BY 4.0","authored_by":"Reversolinguo project editorial draft"},"status":"draft","version":1},{"entry_id":"05350e1b-34f8-5c81-8305-a40ddeadbfd7","language_tag":"es","lemma":"la costa","part_of_speech":"noun","senses":[{"sense_id":"s1","translations":["la côte"],"example_source":"Hay muchos pueblos en la costa.","example_target":"Il y a beaucoup de villages sur la côte."}],"cefr_level":"A2","cefr_rationale":"Candidat éditorial A2 — inventaires notionnels PCIC à valider","themes":["nature-environnement"],"variety":"pan-hispanic-common","provenance":{"source":"Reversolinguo editorial archive fr-es-a1-b2-school-progression-r1-2026-09-15; external references are used only for CEFR/domain framing","license":"CC BY 4.0","authored_by":"Reversolinguo project editorial draft"},"status":"draft","version":1},{"entry_id":"9cf5b5ad-086b-54fe-873c-c9c1573fce69","language_tag":"es","lemma":"el interior","part_of_speech":"noun","senses":[{"sense_id":"s1","translations":["l’intérieur des terres"],"example_source":"En verano viajamos al interior del país.","example_target":"En été, nous voyageons à l’intérieur des terres."}],"cefr_level":"A2","cefr_rationale":"Candidat éditorial A2 — inventaires notionnels PCIC à valider","themes":["nature-environnement"],"variety":"pan-hispanic-common","provenance":{"source":"Reversolinguo editorial archive fr-es-a1-b2-school-progression-r1-2026-09-15; external references are used only for CEFR/domain framing","license":"CC BY 4.0","authored_by":"Reversolinguo project editorial draft"},"status":"draft","version":1},{"entry_id":"e620dfb6-d215-5892-97be-832c69568352","language_tag":"es","lemma":"el habitante / la habitante","part_of_speech":"noun","senses":[{"sense_id":"s1","translations":["l’habitant / l’habitante"],"example_source":"Cada habitante conoce bien su barrio.","example_target":"Chaque habitant connaît bien son quartier."}],"cefr_level":"A2","cefr_rationale":"Candidat éditorial A2 — inventaires notionnels PCIC à valider","themes":["ville-services"],"variety":"pan-hispanic-common","provenance":{"source":"Reversolinguo editorial archive fr-es-a1-b2-school-progression-r1-2026-09-15; external references are used only for CEFR/domain framing","license":"CC BY 4.0","authored_by":"Reversolinguo project editorial draft"},"status":"draft","version":1},{"entry_id":"6c6cafaa-b5bf-5615-badc-f0460ffec38d","language_tag":"es","lemma":"el barrio","part_of_speech":"noun","senses":[{"sense_id":"s1","translations":["le quartier"],"example_source":"Mi barrio es tranquilo y tiene muchos comercios.","example_target":"Mon quartier est calme et a beaucoup de commerces."}],"cefr_level":"A2","cefr_rationale":"Candidat éditorial A2 — inventaires notionnels PCIC à valider","themes":["ville-services"],"variety":"pan-hispanic-common","provenance":{"source":"Reversolinguo editorial archive fr-es-a1-b2-school-progression-r1-2026-09-15; external references are used only for CEFR/domain framing","license":"CC BY 4.0","authored_by":"Reversolinguo project editorial draft"},"status":"draft","version":1},{"entry_id":"c1d794b0-eb95-59ac-9e3d-b1415ef480ec","language_tag":"es","lemma":"la esquina","part_of_speech":"noun","senses":[{"sense_id":"s1","translations":["le coin / l’angle de rue"],"example_source":"La farmacia está en la esquina.","example_target":"La pharmacie est au coin de la rue."}],"cefr_level":"A2","cefr_rationale":"Candidat éditorial A2 — inventaires notionnels PCIC à valider","themes":["ville-services"],"variety":"pan-hispanic-common","provenance":{"source":"Reversolinguo editorial archive fr-es-a1-b2-school-progression-r1-2026-09-15; external references are used only for CEFR/domain framing","license":"CC BY 4.0","authored_by":"Reversolinguo project editorial draft"},"status":"draft","version":1},{"entry_id":"eb3ef47d-b53f-5602-91c4-a2a767205e1d","language_tag":"es","lemma":"la plaza mayor","part_of_speech":"noun","senses":[{"sense_id":"s1","translations":["la grand-place / Plaza Mayor"],"example_source":"Nos encontramos en la plaza mayor.","example_target":"Nous nous retrouvons sur la grand-place."}],"cefr_level":"A2","cefr_rationale":"Candidat éditorial A2 — inventaires notionnels PCIC à valider","themes":["ville-services"],"variety":"pan-hispanic-common","provenance":{"source":"Reversolinguo editorial archive fr-es-a1-b2-school-progression-r1-2026-09-15; external references are used only for CEFR/domain framing","license":"CC BY 4.0","authored_by":"Reversolinguo project editorial draft"},"status":"draft","version":1}]