[{"entry_id":"b9f7fb1a-d3fa-5b2b-8374-1c64194f8b93","language_tag":"es","lemma":"socorro","part_of_speech":"expression","senses":[{"sense_id":"s1","translations":["au secours"],"example_source":"¡Socorro! Necesitamos ayuda.","example_target":"Au secours ! Nous avons besoin d’aide."}],"cefr_level":"A2","cefr_rationale":"Candidat éditorial A2 — inventaires notionnels PCIC à valider","themes":["ville-services"],"variety":"pan-hispanic-common","provenance":{"source":"Reversolinguo editorial archive fr-es-a1-b2-school-progression-r1-2026-09-15; external references are used only for CEFR/domain framing","license":"CC BY 4.0","authored_by":"Reversolinguo project editorial draft"},"status":"draft","version":1},{"entry_id":"fb9f9526-5261-58ae-b669-0fb8d5e8ed89","language_tag":"es","lemma":"llamar a la policía","part_of_speech":"expression","senses":[{"sense_id":"s1","translations":["appeler la police"],"example_source":"Hay que llamar a la policía.","example_target":"Il faut appeler la police."}],"cefr_level":"A2","cefr_rationale":"Candidat éditorial A2 — inventaires notionnels PCIC à valider","themes":["ville-services"],"variety":"pan-hispanic-common","provenance":{"source":"Reversolinguo editorial archive fr-es-a1-b2-school-progression-r1-2026-09-15; external references are used only for CEFR/domain framing","license":"CC BY 4.0","authored_by":"Reversolinguo project editorial draft"},"status":"draft","version":1},{"entry_id":"6d5883d2-3311-5007-9daf-9632a55e029a","language_tag":"es","lemma":"llamar a los bomberos","part_of_speech":"expression","senses":[{"sense_id":"s1","translations":["appeler les pompiers"],"example_source":"Vamos a llamar a los bomberos.","example_target":"Nous allons appeler les pompiers."}],"cefr_level":"A2","cefr_rationale":"Candidat éditorial A2 — inventaires notionnels PCIC à valider","themes":["ville-services"],"variety":"pan-hispanic-common","provenance":{"source":"Reversolinguo editorial archive fr-es-a1-b2-school-progression-r1-2026-09-15; external references are used only for CEFR/domain framing","license":"CC BY 4.0","authored_by":"Reversolinguo project editorial draft"},"status":"draft","version":1},{"entry_id":"a0504916-253e-514b-bd1c-2679f7dfe007","language_tag":"es","lemma":"el teléfono de emergencia","part_of_speech":"noun","senses":[{"sense_id":"s1","translations":["le numéro d’urgence"],"example_source":"Apunta el teléfono de emergencia.","example_target":"Note le numéro d’urgence."}],"cefr_level":"A2","cefr_rationale":"Candidat éditorial A2 — inventaires notionnels PCIC à valider","themes":["ville-services"],"variety":"pan-hispanic-common","provenance":{"source":"Reversolinguo editorial archive fr-es-a1-b2-school-progression-r1-2026-09-15; external references are used only for CEFR/domain framing","license":"CC BY 4.0","authored_by":"Reversolinguo project editorial draft"},"status":"draft","version":1},{"entry_id":"040f2fcc-8e20-5920-941a-9fb96fe5aaae","language_tag":"es","lemma":"la Seguridad Social","part_of_speech":"noun","senses":[{"sense_id":"s1","translations":["la Sécurité sociale"],"example_source":"Necesito un documento de la Seguridad Social.","example_target":"J’ai besoin d’un document de la Sécurité sociale."}],"cefr_level":"A2","cefr_rationale":"Candidat éditorial A2 — inventaires notionnels PCIC à valider","themes":["ville-services"],"variety":"pan-hispanic-common","provenance":{"source":"Reversolinguo editorial archive fr-es-a1-b2-school-progression-r1-2026-09-15; external references are used only for CEFR/domain framing","license":"CC BY 4.0","authored_by":"Reversolinguo project editorial draft"},"status":"draft","version":1},{"entry_id":"5d878627-4b94-52fc-a2ca-e596137827c2","language_tag":"es","lemma":"la Cruz Roja","part_of_speech":"noun","senses":[{"sense_id":"s1","translations":["la Croix-Rouge"],"example_source":"La Cruz Roja ayuda en la emergencia.","example_target":"La Croix-Rouge aide pendant l’urgence."}],"cefr_level":"A2","cefr_rationale":"Candidat éditorial A2 — inventaires notionnels PCIC à valider","themes":["ville-services"],"variety":"pan-hispanic-common","provenance":{"source":"Reversolinguo editorial archive fr-es-a1-b2-school-progression-r1-2026-09-15; external references are used only for CEFR/domain framing","license":"CC BY 4.0","authored_by":"Reversolinguo project editorial draft"},"status":"draft","version":1},{"entry_id":"70458463-581d-558a-bf3c-1bd562ed8ea3","language_tag":"es","lemma":"el gobierno","part_of_speech":"noun","senses":[{"sense_id":"s1","translations":["le gouvernement"],"example_source":"El gobierno anuncia una nueva medida.","example_target":"Le gouvernement annonce une nouvelle mesure."}],"cefr_level":"A2","cefr_rationale":"Candidat éditorial A2 — inventaires notionnels PCIC à valider","themes":["ville-services"],"variety":"pan-hispanic-common","provenance":{"source":"Reversolinguo editorial archive fr-es-a1-b2-school-progression-r1-2026-09-15; external references are used only for CEFR/domain framing","license":"CC BY 4.0","authored_by":"Reversolinguo project editorial draft"},"status":"draft","version":1},{"entry_id":"c5b58491-fba9-51e8-8662-99e86fbbe746","language_tag":"es","lemma":"la política","part_of_speech":"noun","senses":[{"sense_id":"s1","translations":["la politique"],"example_source":"Hablan de política en las noticias.","example_target":"Ils parlent de politique aux informations."}],"cefr_level":"A2","cefr_rationale":"Candidat éditorial A2 — inventaires notionnels PCIC à valider","themes":["ville-services"],"variety":"pan-hispanic-common","provenance":{"source":"Reversolinguo editorial archive fr-es-a1-b2-school-progression-r1-2026-09-15; external references are used only for CEFR/domain framing","license":"CC BY 4.0","authored_by":"Reversolinguo project editorial draft"},"status":"draft","version":1},{"entry_id":"09cf7459-6058-5721-94bc-9fa22dec51a3","language_tag":"es","lemma":"el partido político","part_of_speech":"noun","senses":[{"sense_id":"s1","translations":["le parti politique"],"example_source":"Ese partido político presenta su programa.","example_target":"Ce parti politique présente son programme."}],"cefr_level":"A2","cefr_rationale":"Candidat éditorial A2 — inventaires notionnels PCIC à valider","themes":["ville-services"],"variety":"pan-hispanic-common","provenance":{"source":"Reversolinguo editorial archive fr-es-a1-b2-school-progression-r1-2026-09-15; external references are used only for CEFR/domain framing","license":"CC BY 4.0","authored_by":"Reversolinguo project editorial draft"},"status":"draft","version":1},{"entry_id":"d8841de4-8e82-5a1c-934f-3c8176da0541","language_tag":"es","lemma":"el primer ministro / la primera ministra","part_of_speech":"noun","senses":[{"sense_id":"s1","translations":["le Premier ministre / la Première ministre"],"example_source":"La primera ministra habla en televisión.","example_target":"La Première ministre parle à la télévision."}],"cefr_level":"A2","cefr_rationale":"Candidat éditorial A2 — inventaires notionnels PCIC à valider","themes":["ville-services"],"variety":"pan-hispanic-common","provenance":{"source":"Reversolinguo editorial archive fr-es-a1-b2-school-progression-r1-2026-09-15; external references are used only for CEFR/domain framing","license":"CC BY 4.0","authored_by":"Reversolinguo project editorial draft"},"status":"draft","version":1},{"entry_id":"54efd536-cc90-50e5-a29c-f680ce65edeb","language_tag":"es","lemma":"el príncipe / la princesa","part_of_speech":"noun","senses":[{"sense_id":"s1","translations":["le prince / la princesse"],"example_source":"La princesa visita la ciudad.","example_target":"La princesse visite la ville."}],"cefr_level":"A2","cefr_rationale":"Candidat éditorial A2 — inventaires notionnels PCIC à valider","themes":["ville-services"],"variety":"pan-hispanic-common","provenance":{"source":"Reversolinguo editorial archive fr-es-a1-b2-school-progression-r1-2026-09-15; external references are used only for CEFR/domain framing","license":"CC BY 4.0","authored_by":"Reversolinguo project editorial draft"},"status":"draft","version":1},{"entry_id":"76384880-78c2-5bd2-8a2c-0d9197b10d50","language_tag":"es","lemma":"el ayuntamiento","part_of_speech":"noun","senses":[{"sense_id":"s1","translations":["la mairie / l’hôtel de ville"],"example_source":"El ayuntamiento está en la plaza.","example_target":"La mairie est sur la place."}],"cefr_level":"A2","cefr_rationale":"Candidat éditorial A2 — inventaires notionnels PCIC à valider","themes":["ville-services"],"variety":"pan-hispanic-common","provenance":{"source":"Reversolinguo editorial archive fr-es-a1-b2-school-progression-r1-2026-09-15; external references are used only for CEFR/domain framing","license":"CC BY 4.0","authored_by":"Reversolinguo project editorial draft"},"status":"draft","version":1}]