[
  {
    "entry_id": "ef0df1bf-99c1-593d-83ee-9c8d28f05ed8",
    "language_tag": "es",
    "lemma": "el diccionario",
    "part_of_speech": "noun",
    "gender": "masculine",
    "article": "el",
    "senses": [{"sense_id":"s1","translations":["le dictionnaire"],"example_source":"Busco una palabra en el diccionario.","example_target":"Je cherche un mot dans le dictionnaire."}],
    "cefr_level": "A1",
    "cefr_rationale": "Candidat éditorial A1 — domaine CECRL/PCIC à valider",
    "themes": ["ecole-etudes"],
    "variety": "pan-hispanic-common",
    "provenance": {"source":"Reversolinguo editorial archive fr-es-a1-b2-school-progression-r1-2026-09-15; external references are used only for CEFR/domain framing","license":"CC BY 4.0","authored_by":"Reversolinguo project editorial draft"},
    "status": "draft",
    "version": 1
  },
  {
    "entry_id": "39292b19-0e4b-513c-bb00-d08d5add58ac",
    "language_tag": "es",
    "lemma": "el papel",
    "part_of_speech": "noun",
    "gender": "masculine",
    "article": "el",
    "senses": [{"sense_id":"s1","translations":["le papier"],"example_source":"Necesito papel para escribir.","example_target":"J’ai besoin de papier pour écrire."}],
    "cefr_level": "A1",
    "cefr_rationale": "Candidat éditorial A1 — domaine CECRL/PCIC à valider",
    "themes": ["ecole-etudes"],
    "variety": "pan-hispanic-common",
    "provenance": {"source":"Reversolinguo editorial archive fr-es-a1-b2-school-progression-r1-2026-09-15; external references are used only for CEFR/domain framing","license":"CC BY 4.0","authored_by":"Reversolinguo project editorial draft"},
    "status": "draft",
    "version": 1
  },
  {
    "entry_id": "988c72bb-df13-5ff1-8d43-a9e1e568793d",
    "language_tag": "es",
    "lemma": "el bolígrafo",
    "part_of_speech": "noun",
    "gender": "masculine",
    "article": "el",
    "senses": [{"sense_id":"s1","translations":["le stylo"],"example_source":"Escribo con un bolígrafo azul.","example_target":"J’écris avec un stylo bleu."}],
    "cefr_level": "A1",
    "cefr_rationale": "Candidat éditorial A1 — domaine CECRL/PCIC à valider",
    "themes": ["ecole-etudes"],
    "variety": "pan-hispanic-common",
    "provenance": {"source":"Reversolinguo editorial archive fr-es-a1-b2-school-progression-r1-2026-09-15; external references are used only for CEFR/domain framing","license":"CC BY 4.0","authored_by":"Reversolinguo project editorial draft"},
    "status": "draft",
    "version": 1
  },
  {
    "entry_id": "8c2ccfb2-d5bd-5665-919e-7a133b608cb7",
    "language_tag": "es",
    "lemma": "el lápiz",
    "part_of_speech": "noun",
    "gender": "masculine",
    "article": "el",
    "senses": [{"sense_id":"s1","translations":["le crayon"],"example_source":"Escribo mi nombre con lápiz.","example_target":"J’écris mon nom au crayon."}],
    "cefr_level": "A1",
    "cefr_rationale": "Candidat éditorial A1 — domaine CECRL/PCIC à valider",
    "themes": ["ecole-etudes"],
    "variety": "pan-hispanic-common",
    "provenance": {"source":"Reversolinguo editorial archive fr-es-a1-b2-school-progression-r1-2026-09-15; external references are used only for CEFR/domain framing","license":"CC BY 4.0","authored_by":"Reversolinguo project editorial draft"},
    "status": "draft",
    "version": 1
  },
  {
    "entry_id": "e343d296-e92c-5686-b4ea-2f039fa585b2",
    "language_tag": "es",
    "lemma": "la goma",
    "part_of_speech": "noun",
    "gender": "feminine",
    "article": "la",
    "senses": [{"sense_id":"s1","translations":["la gomme"],"example_source":"Necesito una goma.","example_target":"J’ai besoin d’une gomme."}],
    "cefr_level": "A1",
    "cefr_rationale": "Candidat éditorial A1 — domaine CECRL/PCIC à valider",
    "themes": ["ecole-etudes"],
    "variety": "pan-hispanic-common",
    "provenance": {"source":"Reversolinguo editorial archive fr-es-a1-b2-school-progression-r1-2026-09-15; external references are used only for CEFR/domain framing","license":"CC BY 4.0","authored_by":"Reversolinguo project editorial draft"},
    "status": "draft",
    "version": 1
  },
  {
    "entry_id": "891b493e-9e51-515c-9e29-5a1bf7747559",
    "language_tag": "es",
    "lemma": "la fotocopia",
    "part_of_speech": "noun",
    "gender": "feminine",
    "article": "la",
    "senses": [{"sense_id":"s1","translations":["la photocopie"],"example_source":"Tengo una fotocopia del documento.","example_target":"J’ai une photocopie du document."}],
    "cefr_level": "A1",
    "cefr_rationale": "Candidat éditorial A1 — domaine CECRL/PCIC à valider",
    "themes": ["ecole-etudes"],
    "variety": "pan-hispanic-common",
    "provenance": {"source":"Reversolinguo editorial archive fr-es-a1-b2-school-progression-r1-2026-09-15; external references are used only for CEFR/domain framing","license":"CC BY 4.0","authored_by":"Reversolinguo project editorial draft"},
    "status": "draft",
    "version": 1
  },
  {
    "entry_id": "fc35541f-45f3-5b76-9928-d74482c55522",
    "language_tag": "es",
    "lemma": "el mapa",
    "part_of_speech": "noun",
    "gender": "masculine",
    "article": "el",
    "senses": [{"sense_id":"s1","translations":["la carte"],"example_source":"Miro el mapa de la ciudad.","example_target":"Je regarde la carte de la ville."}],
    "cefr_level": "A1",
    "cefr_rationale": "Candidat éditorial A1 — domaine CECRL/PCIC à valider",
    "themes": ["ecole-etudes"],
    "variety": "pan-hispanic-common",
    "provenance": {"source":"Reversolinguo editorial archive fr-es-a1-b2-school-progression-r1-2026-09-15; external references are used only for CEFR/domain framing","license":"CC BY 4.0","authored_by":"Reversolinguo project editorial draft"},
    "status": "draft",
    "version": 1
  },
  {
    "entry_id": "5f7d3fa0-5ba3-5a22-a74e-a012d97a04ba",
    "language_tag": "es",
    "lemma": "el trabajo",
    "part_of_speech": "noun",
    "gender": "masculine",
    "article": "el",
    "senses": [{"sense_id":"s1","translations":["le travail"],"example_source":"Tengo mucho trabajo hoy.","example_target":"J’ai beaucoup de travail aujourd’hui.","note":"Cette entrée cible l’activité « travail » ; le sens « emploi » est traité séparément par « tener trabajo »."}],
    "cefr_level": "A1",
    "cefr_rationale": "Candidat éditorial A1 — domaine CECRL/PCIC à valider",
    "themes": ["travail-metiers"],
    "variety": "pan-hispanic-common",
    "provenance": {"source":"Reversolinguo editorial archive fr-es-a1-b2-school-progression-r1-2026-09-15; external references are used only for CEFR/domain framing","license":"CC BY 4.0","authored_by":"Reversolinguo project editorial draft"},
    "status": "draft",
    "version": 1
  },
  {
    "entry_id": "5bf363a5-ffdf-5960-9e68-8f73a7d20e2f",
    "language_tag": "es",
    "lemma": "la profesión",
    "part_of_speech": "noun",
    "gender": "feminine",
    "article": "la",
    "senses": [{"sense_id":"s1","translations":["la profession"],"example_source":"¿Cuál es tu profesión?","example_target":"Quelle est ta profession ?"}],
    "cefr_level": "A1",
    "cefr_rationale": "Candidat éditorial A1 — domaine CECRL/PCIC à valider",
    "themes": ["travail-metiers"],
    "variety": "pan-hispanic-common",
    "provenance": {"source":"Reversolinguo editorial archive fr-es-a1-b2-school-progression-r1-2026-09-15; external references are used only for CEFR/domain framing","license":"CC BY 4.0","authored_by":"Reversolinguo project editorial draft"},
    "status": "draft",
    "version": 1
  },
  {
    "entry_id": "f7109d37-505a-5faa-aa4a-f654f20cd196",
    "language_tag": "es",
    "lemma": "trabajar",
    "part_of_speech": "verb",
    "senses": [{"sense_id":"s1","translations":["travailler"],"example_source":"Trabajo en una oficina.","example_target":"Je travaille dans un bureau."}],
    "cefr_level": "A1",
    "cefr_rationale": "Candidat éditorial A1 — domaine CECRL/PCIC à valider",
    "themes": ["travail-metiers"],
    "variety": "pan-hispanic-common",
    "provenance": {"source":"Reversolinguo editorial archive fr-es-a1-b2-school-progression-r1-2026-09-15; external references are used only for CEFR/domain framing","license":"CC BY 4.0","authored_by":"Reversolinguo project editorial draft"},
    "status": "draft",
    "version": 1
  },
  {
    "entry_id": "49676802-665f-5e97-b7d7-055607a15cf1",
    "language_tag": "es",
    "lemma": "dedicarse a",
    "part_of_speech": "expression",
    "senses": [{"sense_id":"s1","translations":["exercer comme"],"example_source":"Ana se dedica a la medicina.","example_target":"Ana exerce comme médecin.","note":"Cette entrée cible l’usage professionnel « exercer comme » ; d’autres sens de « dedicarse a » seront traités ultérieurement."}],
    "cefr_level": "A1",
    "cefr_rationale": "Candidat éditorial A1 — domaine CECRL/PCIC à valider",
    "themes": ["travail-metiers"],
    "variety": "pan-hispanic-common",
    "provenance": {"source":"Reversolinguo editorial archive fr-es-a1-b2-school-progression-r1-2026-09-15; external references are used only for CEFR/domain framing","license":"CC BY 4.0","authored_by":"Reversolinguo project editorial draft"},
    "status": "draft",
    "version": 1
  }
]
