[{"entry_id":"9fac47f5-a067-586e-b50f-5fd84f0824e6","language_tag":"es","lemma":"el chat","part_of_speech":"noun","senses":[{"sense_id":"s1","translations":["le chat / salon de discussion"],"example_source":"Hablamos en el chat de la clase.","example_target":"Nous discutons dans le chat de la classe."}],"cefr_level":"A2","cefr_rationale":"Candidat éditorial A2 — inventaires notionnels PCIC à valider","themes":["numerique"],"variety":"pan-hispanic-common","provenance":{"source":"Reversolinguo editorial archive fr-es-a1-b2-school-progression-r1-2026-09-15; external references are used only for CEFR/domain framing","license":"CC BY 4.0","authored_by":"Reversolinguo project editorial draft"},"status":"draft","version":1},{"entry_id":"d0994dea-0dcb-58d3-9660-1ebd24d5da83","language_tag":"es","lemma":"el virus","part_of_speech":"noun","senses":[{"sense_id":"s1","translations":["le virus informatique"],"example_source":"El antivirus ha encontrado un virus.","example_target":"L’antivirus a trouvé un virus informatique."}],"cefr_level":"A2","cefr_rationale":"Candidat éditorial A2 — inventaires notionnels PCIC à valider","themes":["numerique"],"variety":"pan-hispanic-common","provenance":{"source":"Reversolinguo editorial archive fr-es-a1-b2-school-progression-r1-2026-09-15; external references are used only for CEFR/domain framing","license":"CC BY 4.0","authored_by":"Reversolinguo project editorial draft"},"status":"draft","version":1},{"entry_id":"e7b4cc6d-40e4-503d-a1c8-7b9bc405041a","language_tag":"es","lemma":"navegar por Internet","part_of_speech":"expression","senses":[{"sense_id":"s1","translations":["naviguer sur Internet"],"example_source":"Uso el ordenador para navegar por Internet.","example_target":"J’utilise l’ordinateur pour naviguer sur Internet."}],"cefr_level":"A2","cefr_rationale":"Candidat éditorial A2 — inventaires notionnels PCIC à valider","themes":["numerique"],"variety":"pan-hispanic-common","provenance":{"source":"Reversolinguo editorial archive fr-es-a1-b2-school-progression-r1-2026-09-15; external references are used only for CEFR/domain framing","license":"CC BY 4.0","authored_by":"Reversolinguo project editorial draft"},"status":"draft","version":1},{"entry_id":"e6089102-f6aa-5b7f-b955-6c89aa7aafaf","language_tag":"es","lemma":"navegar por la red","part_of_speech":"expression","senses":[{"sense_id":"s1","translations":["naviguer sur le Web"],"example_source":"Por la tarde navego por la red.","example_target":"L’après-midi, je navigue sur le Web."}],"cefr_level":"A2","cefr_rationale":"Candidat éditorial A2 — inventaires notionnels PCIC à valider","themes":["numerique"],"variety":"pan-hispanic-common","provenance":{"source":"Reversolinguo editorial archive fr-es-a1-b2-school-progression-r1-2026-09-15; external references are used only for CEFR/domain framing","license":"CC BY 4.0","authored_by":"Reversolinguo project editorial draft"},"status":"draft","version":1},{"entry_id":"c0bfc1fb-f9b1-584d-a534-eb00d30a8997","language_tag":"es","lemma":"enviar un mensaje","part_of_speech":"expression","senses":[{"sense_id":"s1","translations":["envoyer un message"],"example_source":"Te voy a enviar un mensaje.","example_target":"Je vais t’envoyer un message."}],"cefr_level":"A2","cefr_rationale":"Candidat éditorial A2 — inventaires notionnels PCIC à valider","themes":["numerique"],"variety":"pan-hispanic-common","provenance":{"source":"Reversolinguo editorial archive fr-es-a1-b2-school-progression-r1-2026-09-15; external references are used only for CEFR/domain framing","license":"CC BY 4.0","authored_by":"Reversolinguo project editorial draft"},"status":"draft","version":1},{"entry_id":"d83ac15e-71fd-57f4-b68d-81b9b5265b8e","language_tag":"es","lemma":"el ordenador portátil","part_of_speech":"noun","senses":[{"sense_id":"s1","translations":["l’ordinateur portable"],"example_source":"Llevo el ordenador portátil a clase.","example_target":"J’emporte l’ordinateur portable en cours."}],"cefr_level":"A2","cefr_rationale":"Candidat éditorial A2 — inventaires notionnels PCIC à valider","themes":["numerique"],"variety":"pan-hispanic-common","provenance":{"source":"Reversolinguo editorial archive fr-es-a1-b2-school-progression-r1-2026-09-15; external references are used only for CEFR/domain framing","license":"CC BY 4.0","authored_by":"Reversolinguo project editorial draft"},"status":"draft","version":1},{"entry_id":"4d652605-dcca-5f87-a953-3be5d8fbccfa","language_tag":"es","lemma":"el PC","part_of_speech":"noun","senses":[{"sense_id":"s1","translations":["le PC"],"example_source":"El PC está en el escritorio.","example_target":"Le PC est sur le bureau."}],"cefr_level":"A2","cefr_rationale":"Candidat éditorial A2 — inventaires notionnels PCIC à valider","themes":["numerique"],"variety":"pan-hispanic-common","provenance":{"source":"Reversolinguo editorial archive fr-es-a1-b2-school-progression-r1-2026-09-15; external references are used only for CEFR/domain framing","license":"CC BY 4.0","authored_by":"Reversolinguo project editorial draft"},"status":"draft","version":1},{"entry_id":"ea9df4f9-ac0d-50c3-a8c6-4611edf546be","language_tag":"es","lemma":"la informática","part_of_speech":"noun","senses":[{"sense_id":"s1","translations":["l’informatique"],"example_source":"Me interesa la informática.","example_target":"L’informatique m’intéresse."}],"cefr_level":"A2","cefr_rationale":"Candidat éditorial A2 — inventaires notionnels PCIC à valider","themes":["numerique"],"variety":"pan-hispanic-common","provenance":{"source":"Reversolinguo editorial archive fr-es-a1-b2-school-progression-r1-2026-09-15; external references are used only for CEFR/domain framing","license":"CC BY 4.0","authored_by":"Reversolinguo project editorial draft"},"status":"draft","version":1},{"entry_id":"6cf614b5-f0f2-5637-8e01-a098e2383f88","language_tag":"es","lemma":"el informático / la informática","part_of_speech":"noun","senses":[{"sense_id":"s1","translations":["l’informaticien / l’informaticienne"],"example_source":"La informática trabaja en una empresa pequeña.","example_target":"L’informaticienne travaille dans une petite entreprise.","note":"Ici « la informática » désigne une informaticienne ; homographe de « la informática » = l’informatique. La paire lexicale est conservée comme dans la source."}],"cefr_level":"A2","cefr_rationale":"Candidat éditorial A2 — inventaires notionnels PCIC à valider","themes":["numerique"],"variety":"pan-hispanic-common","provenance":{"source":"Reversolinguo editorial archive fr-es-a1-b2-school-progression-r1-2026-09-15; external references are used only for CEFR/domain framing","license":"CC BY 4.0","authored_by":"Reversolinguo project editorial draft"},"status":"draft","version":1},{"entry_id":"23485c6d-7863-5393-91e2-8c827a0cfeb1","language_tag":"es","lemma":"chatear","part_of_speech":"verb","senses":[{"sense_id":"s1","translations":["chatter / discuter en ligne"],"example_source":"Chateo con mis amigos después de clase.","example_target":"Je discute en ligne avec mes amis après les cours."}],"cefr_level":"A2","cefr_rationale":"Candidat éditorial A2 — inventaires notionnels PCIC à valider","themes":["numerique"],"variety":"pan-hispanic-common","provenance":{"source":"Reversolinguo editorial archive fr-es-a1-b2-school-progression-r1-2026-09-15; external references are used only for CEFR/domain framing","license":"CC BY 4.0","authored_by":"Reversolinguo project editorial draft"},"status":"draft","version":1}]