[{"entry_id":"10a30937-0606-556b-8d0c-3f35fe097a0e","language_tag":"es","lemma":"este año","part_of_speech":"expression","senses":[{"sense_id":"s1","translations":["cette année"],"example_source":"Este año estudio más español.","example_target":"Cette année, j’étudie davantage l’espagnol."}],"cefr_level":"A2","cefr_rationale":"Candidat éditorial A2 — inventaires notionnels PCIC à valider","themes":["temps"],"variety":"pan-hispanic-common","provenance":{"source":"Reversolinguo editorial archive fr-es-a1-b2-school-progression-r1-2026-09-15; external references are used only for CEFR/domain framing","license":"CC BY 4.0","authored_by":"Reversolinguo project editorial draft"},"status":"draft","version":1},{"entry_id":"1a2bf056-e2ec-5ac6-8296-cad86d53ee30","language_tag":"es","lemma":"la semana pasada","part_of_speech":"expression","senses":[{"sense_id":"s1","translations":["la semaine dernière"],"example_source":"La semana pasada visitamos a mis abuelos.","example_target":"La semaine dernière, nous avons rendu visite à mes grands-parents."}],"cefr_level":"A2","cefr_rationale":"Candidat éditorial A2 — inventaires notionnels PCIC à valider","themes":["temps"],"variety":"pan-hispanic-common","provenance":{"source":"Reversolinguo editorial archive fr-es-a1-b2-school-progression-r1-2026-09-15; external references are used only for CEFR/domain framing","license":"CC BY 4.0","authored_by":"Reversolinguo project editorial draft"},"status":"draft","version":1},{"entry_id":"cff147af-1fcd-5745-82f8-905c5a383a6f","language_tag":"es","lemma":"el mes pasado","part_of_speech":"expression","senses":[{"sense_id":"s1","translations":["le mois dernier"],"example_source":"El mes pasado fui a Madrid.","example_target":"Le mois dernier, je suis allé à Madrid."}],"cefr_level":"A2","cefr_rationale":"Candidat éditorial A2 — inventaires notionnels PCIC à valider","themes":["temps"],"variety":"pan-hispanic-common","provenance":{"source":"Reversolinguo editorial archive fr-es-a1-b2-school-progression-r1-2026-09-15; external references are used only for CEFR/domain framing","license":"CC BY 4.0","authored_by":"Reversolinguo project editorial draft"},"status":"draft","version":1},{"entry_id":"601b4397-5d52-5f29-86a5-983d9b0710f1","language_tag":"es","lemma":"el año pasado","part_of_speech":"expression","senses":[{"sense_id":"s1","translations":["l’année dernière"],"example_source":"El año pasado aprendí mucho.","example_target":"L’année dernière, j’ai beaucoup appris."}],"cefr_level":"A2","cefr_rationale":"Candidat éditorial A2 — inventaires notionnels PCIC à valider","themes":["temps"],"variety":"pan-hispanic-common","provenance":{"source":"Reversolinguo editorial archive fr-es-a1-b2-school-progression-r1-2026-09-15; external references are used only for CEFR/domain framing","license":"CC BY 4.0","authored_by":"Reversolinguo project editorial draft"},"status":"draft","version":1},{"entry_id":"05c93796-0b88-5857-ac6e-2633986bc9a9","language_tag":"es","lemma":"la semana que viene","part_of_speech":"expression","senses":[{"sense_id":"s1","translations":["la semaine prochaine"],"example_source":"La semana que viene tenemos un examen.","example_target":"La semaine prochaine, nous avons un examen."}],"cefr_level":"A2","cefr_rationale":"Candidat éditorial A2 — inventaires notionnels PCIC à valider","themes":["temps"],"variety":"pan-hispanic-common","provenance":{"source":"Reversolinguo editorial archive fr-es-a1-b2-school-progression-r1-2026-09-15; external references are used only for CEFR/domain framing","license":"CC BY 4.0","authored_by":"Reversolinguo project editorial draft"},"status":"draft","version":1},{"entry_id":"33db8e45-cf13-5e8e-9a8e-8f677311924d","language_tag":"es","lemma":"el mes que viene","part_of_speech":"expression","senses":[{"sense_id":"s1","translations":["le mois prochain"],"example_source":"El mes que viene vamos de viaje.","example_target":"Le mois prochain, nous partons en voyage."}],"cefr_level":"A2","cefr_rationale":"Candidat éditorial A2 — inventaires notionnels PCIC à valider","themes":["temps"],"variety":"pan-hispanic-common","provenance":{"source":"Reversolinguo editorial archive fr-es-a1-b2-school-progression-r1-2026-09-15; external references are used only for CEFR/domain framing","license":"CC BY 4.0","authored_by":"Reversolinguo project editorial draft"},"status":"draft","version":1},{"entry_id":"9b794b4f-80ea-5c19-907d-d299830cbd15","language_tag":"es","lemma":"el año que viene","part_of_speech":"expression","senses":[{"sense_id":"s1","translations":["l’année prochaine"],"example_source":"El año que viene quiero estudiar en España.","example_target":"L’année prochaine, je veux étudier en Espagne."}],"cefr_level":"A2","cefr_rationale":"Candidat éditorial A2 — inventaires notionnels PCIC à valider","themes":["temps"],"variety":"pan-hispanic-common","provenance":{"source":"Reversolinguo editorial archive fr-es-a1-b2-school-progression-r1-2026-09-15; external references are used only for CEFR/domain framing","license":"CC BY 4.0","authored_by":"Reversolinguo project editorial draft"},"status":"draft","version":1},{"entry_id":"5dd98e01-378e-53db-a9ac-9901cd78a419","language_tag":"es","lemma":"otra vez","part_of_speech":"expression","senses":[{"sense_id":"s1","translations":["encore une fois"],"example_source":"¿Puedes repetirlo otra vez?","example_target":"Peux-tu le répéter encore une fois ?"}],"cefr_level":"A2","cefr_rationale":"Candidat éditorial A2 — inventaires notionnels PCIC à valider","themes":["temps"],"variety":"pan-hispanic-common","provenance":{"source":"Reversolinguo editorial archive fr-es-a1-b2-school-progression-r1-2026-09-15; external references are used only for CEFR/domain framing","license":"CC BY 4.0","authored_by":"Reversolinguo project editorial draft"},"status":"draft","version":1},{"entry_id":"d8966b5b-1a99-5e00-86cf-28822f7eb07d","language_tag":"es","lemma":"muchas veces","part_of_speech":"expression","senses":[{"sense_id":"s1","translations":["souvent / de nombreuses fois"],"example_source":"He visto esa película muchas veces.","example_target":"J’ai vu ce film de nombreuses fois."}],"cefr_level":"A2","cefr_rationale":"Candidat éditorial A2 — inventaires notionnels PCIC à valider","themes":["temps"],"variety":"pan-hispanic-common","provenance":{"source":"Reversolinguo editorial archive fr-es-a1-b2-school-progression-r1-2026-09-15; external references are used only for CEFR/domain framing","license":"CC BY 4.0","authored_by":"Reversolinguo project editorial draft"},"status":"draft","version":1},{"entry_id":"d2ab5f13-6e7e-54be-9cff-82bd71f78730","language_tag":"es","lemma":"durar","part_of_speech":"verb","senses":[{"sense_id":"s1","translations":["durer"],"example_source":"La película dura dos horas.","example_target":"Le film dure deux heures."}],"cefr_level":"A2","cefr_rationale":"Candidat éditorial A2 — inventaires notionnels PCIC à valider","themes":["temps"],"variety":"pan-hispanic-common","provenance":{"source":"Reversolinguo editorial archive fr-es-a1-b2-school-progression-r1-2026-09-15; external references are used only for CEFR/domain framing","license":"CC BY 4.0","authored_by":"Reversolinguo project editorial draft"},"status":"draft","version":1},{"entry_id":"5ed08a8e-8a78-578a-8c3f-b6a40448d5f1","language_tag":"es","lemma":"toda la mañana","part_of_speech":"expression","senses":[{"sense_id":"s1","translations":["toute la matinée"],"example_source":"He estudiado toda la mañana.","example_target":"J’ai étudié toute la matinée."}],"cefr_level":"A2","cefr_rationale":"Candidat éditorial A2 — inventaires notionnels PCIC à valider","themes":["temps"],"variety":"pan-hispanic-common","provenance":{"source":"Reversolinguo editorial archive fr-es-a1-b2-school-progression-r1-2026-09-15; external references are used only for CEFR/domain framing","license":"CC BY 4.0","authored_by":"Reversolinguo project editorial draft"},"status":"draft","version":1},{"entry_id":"065b7005-eeef-5b68-a4f1-84ecc8c95c6b","language_tag":"es","lemma":"toda la tarde","part_of_speech":"expression","senses":[{"sense_id":"s1","translations":["tout l’après-midi"],"example_source":"Trabaja toda la tarde.","example_target":"Il travaille tout l’après-midi."}],"cefr_level":"A2","cefr_rationale":"Candidat éditorial A2 — inventaires notionnels PCIC à valider","themes":["temps"],"variety":"pan-hispanic-common","provenance":{"source":"Reversolinguo editorial archive fr-es-a1-b2-school-progression-r1-2026-09-15; external references are used only for CEFR/domain framing","license":"CC BY 4.0","authored_by":"Reversolinguo project editorial draft"},"status":"draft","version":1}]