[{"entry_id":"169aa8ec-747d-5e83-8e9b-d5ec97813064","language_tag":"es","lemma":"la braga","part_of_speech":"noun","senses":[{"sense_id":"s1","translations":["la culotte"],"example_source":"La braga es de algodón.","example_target":"La culotte est en coton."}],"cefr_level":"A2","cefr_rationale":"Candidat éditorial A2 — inventaires notionnels PCIC à valider","themes":["vetements"],"variety":"pan-hispanic-common","provenance":{"source":"Reversolinguo editorial archive fr-es-a1-b2-school-progression-r1-2026-09-15; external references are used only for CEFR/domain framing","license":"CC BY 4.0","authored_by":"Reversolinguo project editorial draft"},"status":"draft","version":1},{"entry_id":"640658dd-7848-508d-8bb9-8962294d188f","language_tag":"es","lemma":"el calzoncillo","part_of_speech":"noun","senses":[{"sense_id":"s1","translations":["le caleçon / slip"],"example_source":"Compra un paquete de calzoncillos.","example_target":"Il achète un paquet de caleçons."}],"cefr_level":"A2","cefr_rationale":"Candidat éditorial A2 — inventaires notionnels PCIC à valider","themes":["vetements"],"variety":"pan-hispanic-common","provenance":{"source":"Reversolinguo editorial archive fr-es-a1-b2-school-progression-r1-2026-09-15; external references are used only for CEFR/domain framing","license":"CC BY 4.0","authored_by":"Reversolinguo project editorial draft"},"status":"draft","version":1},{"entry_id":"63d5e0fb-ab44-516d-8b49-9bab391409ad","language_tag":"es","lemma":"las medias","part_of_speech":"noun","senses":[{"sense_id":"s1","translations":["les bas / collants selon contexte"],"example_source":"Lleva medias negras.","example_target":"Elle porte des collants noirs."}],"cefr_level":"A2","cefr_rationale":"Candidat éditorial A2 — inventaires notionnels PCIC à valider","themes":["vetements"],"variety":"pan-hispanic-common","provenance":{"source":"Reversolinguo editorial archive fr-es-a1-b2-school-progression-r1-2026-09-15; external references are used only for CEFR/domain framing","license":"CC BY 4.0","authored_by":"Reversolinguo project editorial draft"},"status":"draft","version":1},{"entry_id":"31767f40-f172-5238-b9e0-4b57d8de2e3f","language_tag":"es","lemma":"los calcetines","part_of_speech":"noun","senses":[{"sense_id":"s1","translations":["les chaussettes"],"example_source":"Mis calcetines están mojados.","example_target":"Mes chaussettes sont mouillées."}],"cefr_level":"A2","cefr_rationale":"Candidat éditorial A2 — inventaires notionnels PCIC à valider","themes":["vetements"],"variety":"pan-hispanic-common","provenance":{"source":"Reversolinguo editorial archive fr-es-a1-b2-school-progression-r1-2026-09-15; external references are used only for CEFR/domain framing","license":"CC BY 4.0","authored_by":"Reversolinguo project editorial draft"},"status":"draft","version":1},{"entry_id":"b0afdda0-d73e-59c2-b8e4-ada32c82df5c","language_tag":"es","lemma":"el bañador","part_of_speech":"noun","senses":[{"sense_id":"s1","translations":["le maillot de bain"],"example_source":"No olvides el bañador.","example_target":"N’oublie pas le maillot de bain."}],"cefr_level":"A2","cefr_rationale":"Candidat éditorial A2 — inventaires notionnels PCIC à valider","themes":["vetements"],"variety":"pan-hispanic-common","provenance":{"source":"Reversolinguo editorial archive fr-es-a1-b2-school-progression-r1-2026-09-15; external references are used only for CEFR/domain framing","license":"CC BY 4.0","authored_by":"Reversolinguo project editorial draft"},"status":"draft","version":1},{"entry_id":"2ed4a5ee-c75e-556f-918f-adb0021d9d9b","language_tag":"es","lemma":"el biquini","part_of_speech":"noun","senses":[{"sense_id":"s1","translations":["le bikini"],"example_source":"Este biquini es nuevo.","example_target":"Ce bikini est neuf."}],"cefr_level":"A2","cefr_rationale":"Candidat éditorial A2 — inventaires notionnels PCIC à valider","themes":["vetements"],"variety":"pan-hispanic-common","provenance":{"source":"Reversolinguo editorial archive fr-es-a1-b2-school-progression-r1-2026-09-15; external references are used only for CEFR/domain framing","license":"CC BY 4.0","authored_by":"Reversolinguo project editorial draft"},"status":"draft","version":1},{"entry_id":"6c325182-8206-5841-b3b9-dbcf7496a87f","language_tag":"es","lemma":"las botas","part_of_speech":"noun","senses":[{"sense_id":"s1","translations":["les bottes"],"example_source":"Me pongo las botas para salir.","example_target":"Je mets les bottes pour sortir."}],"cefr_level":"A2","cefr_rationale":"Candidat éditorial A2 — inventaires notionnels PCIC à valider","themes":["vetements"],"variety":"pan-hispanic-common","provenance":{"source":"Reversolinguo editorial archive fr-es-a1-b2-school-progression-r1-2026-09-15; external references are used only for CEFR/domain framing","license":"CC BY 4.0","authored_by":"Reversolinguo project editorial draft"},"status":"draft","version":1},{"entry_id":"7aa5161d-4c0b-5c9f-ac2b-d8c2f74d6425","language_tag":"es","lemma":"el probador","part_of_speech":"noun","senses":[{"sense_id":"s1","translations":["la cabine d’essayage"],"example_source":"El probador está al fondo de la tienda.","example_target":"La cabine d’essayage est au fond du magasin."}],"cefr_level":"A2","cefr_rationale":"Candidat éditorial A2 — inventaires notionnels PCIC à valider","themes":["ville-services"],"variety":"pan-hispanic-common","provenance":{"source":"Reversolinguo editorial archive fr-es-a1-b2-school-progression-r1-2026-09-15; external references are used only for CEFR/domain framing","license":"CC BY 4.0","authored_by":"Reversolinguo project editorial draft"},"status":"draft","version":1},{"entry_id":"387856f5-00eb-5e7d-8db9-da715d4c92a9","language_tag":"es","lemma":"ponerse","part_of_speech":"verb","senses":[{"sense_id":"s1","translations":["mettre / enfiler"],"example_source":"Voy a ponerme el abrigo.","example_target":"Je vais mettre mon manteau."}],"cefr_level":"A2","cefr_rationale":"Candidat éditorial A2 — inventaires notionnels PCIC à valider","themes":["vetements"],"variety":"pan-hispanic-common","provenance":{"source":"Reversolinguo editorial archive fr-es-a1-b2-school-progression-r1-2026-09-15; external references are used only for CEFR/domain framing","license":"CC BY 4.0","authored_by":"Reversolinguo project editorial draft"},"status":"draft","version":1},{"entry_id":"a7aaa3d1-9691-5866-b500-21fea6b7f48f","language_tag":"es","lemma":"quitarse","part_of_speech":"verb","senses":[{"sense_id":"s1","translations":["enlever"],"example_source":"Se quita los zapatos al entrar.","example_target":"Il enlève ses chaussures en entrant."}],"cefr_level":"A2","cefr_rationale":"Candidat éditorial A2 — inventaires notionnels PCIC à valider","themes":["vetements"],"variety":"pan-hispanic-common","provenance":{"source":"Reversolinguo editorial archive fr-es-a1-b2-school-progression-r1-2026-09-15; external references are used only for CEFR/domain framing","license":"CC BY 4.0","authored_by":"Reversolinguo project editorial draft"},"status":"draft","version":1},{"entry_id":"bf732d32-d76f-5f94-9740-520394bc72e0","language_tag":"es","lemma":"probarse","part_of_speech":"verb","senses":[{"sense_id":"s1","translations":["essayer (un vêtement)"],"example_source":"Quiero probarme estos pantalones.","example_target":"Je veux essayer ce pantalon."}],"cefr_level":"A2","cefr_rationale":"Candidat éditorial A2 — inventaires notionnels PCIC à valider","themes":["vetements"],"variety":"pan-hispanic-common","provenance":{"source":"Reversolinguo editorial archive fr-es-a1-b2-school-progression-r1-2026-09-15; external references are used only for CEFR/domain framing","license":"CC BY 4.0","authored_by":"Reversolinguo project editorial draft"},"status":"draft","version":1},{"entry_id":"2147e207-8868-52f1-8875-4a630ef6bbd5","language_tag":"es","lemma":"la docena","part_of_speech":"noun","senses":[{"sense_id":"s1","translations":["la douzaine"],"example_source":"Compro una docena de huevos.","example_target":"J’achète une douzaine d’œufs."}],"cefr_level":"A2","cefr_rationale":"Candidat éditorial A2 — inventaires notionnels PCIC à valider","themes":["ville-services"],"variety":"pan-hispanic-common","provenance":{"source":"Reversolinguo editorial archive fr-es-a1-b2-school-progression-r1-2026-09-15; external references are used only for CEFR/domain framing","license":"CC BY 4.0","authored_by":"Reversolinguo project editorial draft"},"status":"draft","version":1}]